{
  "id": "002_placement_center",
  "description": "Frontal subject placed significantly off-center in frame (x = 0.8)",
  "input": {
    "frame": {
      "t": 1.0,
      "subjects": [
        {
          "id": 1,
          "bounds": { "x": 0.65, "y": 0.2, "width": 0.3, "height": 0.6 },
          "joints": {
            "Nose": {
              "joint_type": "Nose",
              "point": { "x": 0.8, "y": 0.3 },
              "confidence": 0.95
            }
          },
          "facing": "Frontal",
          "shot_type": "HalfBody",
          "confidence": 0.95,
          "mask_summary": null
        }
      ],
      "primary_subject_index": 0,
      "posture": {
        "roll_deg": 0.0,
        "pitch_deg": 0.0,
        "elevation_deg": 0.0
      },
      "camera": {
        "focal_length_mm": 24.0,
        "hfov_deg": 73.7
      },
      "exposure": {
        "iso": 100.0,
        "shutter_speed_sec": 0.002,
        "ev": 12.0
      }
    },
    "light": {
      "direction": "Front",
      "quality": "Soft",
      "sun_azimuth_deg": null,
      "sun_elevation_deg": null,
      "face_to_bg_ratio": 1.0,
      "ev": 12.0,
      "confidence": 0.9
    }
  },
  "expected_findings": [
    {
      "id": "placement.center",
      "severity": "Minor",
      "hint_key": "pan_right"
    }
  ]
}
