{
  "id": "003_head_crop",
  "description": "Subject head cut off at frame boundary (top y = 0.005)",
  "input": {
    "frame": {
      "t": 1.0,
      "subjects": [
        {
          "id": 1,
          "bounds": { "x": 0.35, "y": 0.005, "width": 0.3, "height": 0.8 },
          "joints": {
            "Nose": {
              "joint_type": "Nose",
              "point": { "x": 0.5, "y": 0.05 },
              "confidence": 0.95
            }
          },
          "facing": "Frontal",
          "shot_type": "HalfBody",
          "confidence": 0.95,
          "mask_summary": {
            "top_y": 0.001,
            "bottom_y": 0.8,
            "head_cols": [0.4, 0.6],
            "torso_cols": [0.35, 0.65],
            "leg_cols": [0.38, 0.62]
          }
        }
      ],
      "primary_subject_index": 0,
      "posture": {
        "roll_deg": 0.0,
        "pitch_deg": 0.0,
        "elevation_deg": 0.0
      },
      "camera": {
        "focal_length_mm": 24.0,
        "hfov_deg": 73.7
      },
      "exposure": {
        "iso": 100.0,
        "shutter_speed_sec": 0.002,
        "ev": 12.0
      }
    },
    "light": {
      "direction": "Front",
      "quality": "Soft",
      "sun_azimuth_deg": null,
      "sun_elevation_deg": null,
      "face_to_bg_ratio": 1.0,
      "ev": 12.0,
      "confidence": 0.9
    }
  },
  "expected_findings": [
    {
      "id": "crop.head",
      "severity": "Critical",
      "hint_key": "tilt_up"
    }
  ]
}
