{
  "id": "010_good_to_shoot_fullbody",
  "description": "Well composed full body portrait with level posture and proper headroom (Zero findings expected)",
  "input": {
    "frame": {
      "t": 10.0,
      "subjects": [
        {
          "id": 1,
          "bounds": { "x": 0.35, "y": 0.12, "width": 0.30, "height": 0.80 },
          "joints": {
            "Nose": {
              "joint_type": "Nose",
              "point": { "x": 0.50, "y": 0.20 },
              "confidence": 0.95
            }
          },
          "facing": "Frontal",
          "shot_type": "FullBody",
          "confidence": 0.98,
          "mask_summary": null
        }
      ],
      "primary_subject_index": 0,
      "posture": {
        "roll_deg": 0.2,
        "pitch_deg": -1.5,
        "elevation_deg": -1.5
      },
      "camera": {
        "focal_length_mm": 24.0,
        "hfov_deg": 73.7
      },
      "exposure": {
        "iso": 100.0,
        "shutter_speed_sec": 0.002,
        "ev": 12.0
      }
    },
    "light": {
      "direction": "Front",
      "quality": "Soft",
      "sun_azimuth_deg": null,
      "sun_elevation_deg": null,
      "face_to_bg_ratio": 1.0,
      "ev": 12.0,
      "confidence": 0.85
    }
  },
  "expected_findings": []
}
